title,body,rating,review_date,source,curated,reviewer_name,reviewer_email,product_id,product_handle,reply,reply_date,picture_urls,ip_address,location,metaobject_handle
,"The parcel reached California in 8 days. The quality seems to be good. The gel inside is a little cool even without a refrigerator. The mask is not like a feather, it has some weight and pleasantly squeezes the head. But, unfortunately, the seams are not of such high quality. The threads are sticking out. Let's see how long the mask will last.",5,2024-04-26 00:00:00 UTC,aliexpress,ok,Lavon Hyatt,support+anonymous@judge.me,9551210381604,cold-head-wrap,,,https://raw.githubusercontent.com/gsardar/AliTOGit/master/images/cold-head-wrap/A126b7b284303477ca109f5e5e2f9c7a2z.jpg,,,review-3c596eba-eb78-4885-9d8e-34e9981eacf2
,"I loved it, I used it in a migraine crisis and it helped me a lot... I pointed out now to everyone.",5,2024-06-03 00:00:00 UTC,aliexpress,ok,Jake Christiansen,support+anonymous@judge.me,9551210381604,cold-head-wrap,,,"https://raw.githubusercontent.com/gsardar/AliTOGit/master/images/cold-head-wrap/Acd78537cf65a44349814e274fc9513c7D.jpg, https://raw.githubusercontent.com/gsardar/AliTOGit/master/images/cold-head-wrap/A69c9dbb4040941a8b025ce927d368c24m.jpg",,,review-a3f7e7ef-3844-4df5-9b21-0550e0997875
,According to the published and with the correct description. Shipping according to published. Good seller.,5,2024-07-12 00:00:00 UTC,aliexpress,ok,Winona Jenkins,support+anonymous@judge.me,9551210381604,cold-head-wrap,,,"https://raw.githubusercontent.com/gsardar/AliTOGit/master/images/cold-head-wrap/A452084184f334fea8711fdefedda2084D.jpg, https://raw.githubusercontent.com/gsardar/AliTOGit/master/images/cold-head-wrap/A160debcb9a7c4234a84396c2ee61403eP.jpg, https://raw.githubusercontent.com/gsardar/AliTOGit/master/images/cold-head-wrap/Ad1699c632f684aceaff2bc34d177097e5.jpg, https://raw.githubusercontent.com/gsardar/AliTOGit/master/images/cold-head-wrap/Ae292025894db4bc99bc0d9a6a0bce3e7r.jpg, https://raw.githubusercontent.com/gsardar/AliTOGit/master/images/cold-head-wrap/A7aa05e870dfa4975b6e9ac8d3bb64e577.jpg",,,review-60a62fbc-ffe6-4618-b722-889e8e460a01
,"Arrived in good weather, the item looks good, second time I order, well packed, arrived in combined package, but good, the quality looks good, I will test them and make the comment of their performance, but the first one is very good to recover",5,2024-06-28 00:00:00 UTC,aliexpress,ok,Carolanne Cronin,support+anonymous@judge.me,9551210381604,cold-head-wrap,,,"https://raw.githubusercontent.com/gsardar/AliTOGit/master/images/cold-head-wrap/A4cd21c22a6dc482b9137897014ea91dej.jpg, https://raw.githubusercontent.com/gsardar/AliTOGit/master/images/cold-head-wrap/Ab42ef0f101a146cc846f7f1f6a3193f6S.jpg, https://raw.githubusercontent.com/gsardar/AliTOGit/master/images/cold-head-wrap/A59932479d80b448ebff785a1beaf24f49.jpg, https://raw.githubusercontent.com/gsardar/AliTOGit/master/images/cold-head-wrap/A027138fc99e541f79799864717d965d8j.jpg",,,review-a73ec8ae-5700-4617-b8d6-5c674ad6113e
,Good product. Cool the front very well. I recommend it,5,2024-04-02 00:00:00 UTC,aliexpress,ok,Benedict Ullrich,support+anonymous@judge.me,9551210381604,cold-head-wrap,,,"https://raw.githubusercontent.com/gsardar/AliTOGit/master/images/cold-head-wrap/A8ddbb36a9fa44e83ae9771c327be6f5er.jpg, https://raw.githubusercontent.com/gsardar/AliTOGit/master/images/cold-head-wrap/A7497b80215214492a31a2c0af0f022916.jpg, https://raw.githubusercontent.com/gsardar/AliTOGit/master/images/cold-head-wrap/A2fd36109b22d4a10bc587034232c99947.jpg, https://raw.githubusercontent.com/gsardar/AliTOGit/master/images/cold-head-wrap/Af37cb8d45876414682b502796db7e8e1E.jpg",,,review-e2785f98-63c4-463a-98bf-bce1fc22203e